No.     Time           Source                Destination           Protocol Length Info
    118 0.159070602    2604:6000:1419:404a::6 2607:f8b0:4009:805::2004 TCP      86     42136> 443 [ACK] Seq=936 Ack=52751 Win=2933 Len=0 TSval=2838670553 TSecr=302725484
    119 0.177751097    192.168.0.1           192.168.0.100         DNS      140    Standard query response 0x829b A fonts.gstatic.com CNAME gstaticadssl.l.google.com A 172.217.1.35 OPT
    120 0.178038905    192.168.0.1           192.168.0.100         DNS      152    Standard query response 0x0ec8 AAAA fonts.gstatic.com CNAME gstaticadssl.l.google.com AAAA 2607:f8b0:4009:802::2003 OPT
    121 0.178444739    2604:6000:1419:404a::6 2607:f8b0:4009:802::2003 TCP      94     39596> 443 [SYN] Seq=0 Win=64800 Len=0 MSS=1440 SACK_PERM=1 TSval=4016727607 TSecr=0 WS=128
    122 0.180362133    2607:f8b0:4009:805::2004 2604:6000:1419:404a::6 TCP      86     443> 42188 [ACK] Seq=1883 Ack=1337 Win=68096 Len=0 TSval=319629076 TSecr=2838670536
    123 0.185824541    2607:f8b0:4009:806::2003 2604:6000:1419:404a::6 TCP      86     443> 53154 [ACK] Seq=1 Ack=591 Win=66816 Len=0 TSval=1161394810 TSecr=356743249
    124 0.187455681    2607:f8b0:4009:806::2003 2604:6000:1419:404a::6 TLSv1.3  298    Server Hello, Change Cipher Spec, Application Data
    125 0.187460441    2604:6000:1419:404a::6 2607:f8b0:4009:806::2003 TCP      86     53154> 443 [ACK] Seq=591 Ack=213 Win=64768 Len=0 TSval=356743285 TSecr=1161394811
    126 0.187881868    2604:6000:1419:404a::6 2607:f8b0:4009:806::2003 TLSv1.3  150    Change Cipher Spec, Application Data
    127 0.187975438    2604:6000:1419:404a::6 2607:f8b0:4009:806::2003 TLSv1.3  172    Application Data
    128 0.188000758    2604:6000:1419:404a::6 2607:f8b0:4009:806::2003 TLSv1.3  323    Application Data
    129 0.188267503    2604:6000:1419:404a::6 2607:f8b0:4009:806::2003 TLSv1.3  649    Application Data
    130 0.194787446    2607:f8b0:4009:805::2004 2604:6000:1419:404a::6 TCP      86     443> 42136 [ACK] Seq=52751 Ack=936 Win=609 Len=0 TSval=302725520 TSecr=2838670548
    131 0.211610817    2607:f8b0:4009:802::2003 2604:6000:1419:404a::6 TCP      94     443> 39596 [SYN, ACK] Seq=0 Ack=1 Win=65535 Len=0 MSS=1360 SACK_PERM=1 TSval=3015134314 TSecr=4016727607 WS=256
    132 0.211641489    2604:6000:1419:404a::6 2607:f8b0:4009:802::2003 TCP      86     39596> 443 [ACK] Seq=1 Ack=1 Win=64896 Len=0 TSval=4016727640 TSecr=3015134314
